{
  "version": 1,
  "core": {
    "output_format": "text",
    "color": "auto",
    "verbose": 0,
    "quiet": false
  },
  "paths": {
    "pending_queue": null,
    "bw_binary": "/usr/local/bin/bw"
  },
  "audit": {
    "skip_categories": [
      "weak"
    ],
    "limit_per_category": 25,
    "save_pending_on_sigint": true
  },
  "strength": {
    "min_length": 12,
    "require_digit": true,
    "require_symbol": true,
    "min_character_classes": 2,
    "zxcvbn_min_score": 2,
    "extra_common_passwords": [
      "companyname2024"
    ]
  },
  "dedup": {
    "name_similarity_threshold": 3,
    "treat_www_as_same_domain": true,
    "case_insensitive_usernames": true,
    "compare_only_primary_uri": true
  },
  "folders": {
    "preserve_existing": true,
    "enabled_categories": [
      "Banking & Finance",
      "Email",
      "Social",
      "Shopping",
      "Development",
      "Entertainment",
      "Utilities",
      "Government & ID",
      "Health",
      "Other"
    ],
    "custom_rules": [
      {
        "folder": "Crypto",
        "keywords": [
          "binance",
          "coinbase",
          "kraken"
        ]
      }
    ]
  },
  "ui": {
    "mask_character": "•",
    "show_revision_date": true,
    "color_scheme": "auto",
    "prompt_style": "clack"
  },
  "logging": {
    "format": "text",
    "level": "info"
  }
}
